{"backend":"metal","deviceClass":"macos.apple8.metal.hdr","displayCapabilityDigest":"6ce911d1a514b724b18f8c1d442ac481626670d343676241aa90f593fb4a968c","displayClass":"maintainer-hdr-edr-display","firstFailure":null,"gitRevision":"2ee7116ffb382c021ed575aff223c7b760a2ce7d","hostClass":"maintainer-local-macos-metal","nativeReportDigest":"4db46ff58f9a1b18c3ada0907626e459e63a362021d66bce7fcba9b294061ca9","preflightDigest":"9492c610cb352faec75a4fb3511ef03d9ff297871aeeae4dac3b9b2c64887232","profiles":[{"displayAdaptation":"system-color-management","firstFrameToken":"1","gamut":"rec2020-d65","lastFrameToken":"2001","modeGeneration":2,"presentationReady":true,"profileId":"Hdr.PQ.Rec2020.1000.v1","readbackDigest":"1abafcdde5d8664b0bb629512351380a8690d8669199f4905a1d69e58ef9fee7","settledFrameToken":"2001","targetPeakNits":1000,"transfer":"st2084"},{"displayAdaptation":"system-color-management","firstFrameToken":"1","gamut":"rec2020-d65","lastFrameToken":"2001","modeGeneration":2,"presentationReady":true,"profileId":"Hdr.PQ.Rec2020.2000.v1","readbackDigest":"b35042fe7c0e6e1e757cf416871b13fb5833e93ff40294968cae357304a17c34","settledFrameToken":"2001","targetPeakNits":2000,"transfer":"st2084"},{"displayAdaptation":"none","firstFrameToken":"1","gamut":"rec709-d65","lastFrameToken":"2001","modeGeneration":2,"presentationReady":true,"profileId":"Hdr.Linear.1000.v1","readbackDigest":"b39041372e5822cbde2df134496fe4234777a588c539176a5a93a5d608a560cb","settledFrameToken":"2001","targetPeakNits":1000,"transfer":"metal-edr-linear"},{"displayAdaptation":"none","firstFrameToken":"1","gamut":"rec709-d65","lastFrameToken":"2001","modeGeneration":2,"presentationReady":true,"profileId":"Hdr.Linear.2000.v1","readbackDigest":"88408d3cd9ed0d49dc2aa73a7dec5422ed5ed3398639aa9479e418cf2a0349a5","settledFrameToken":"2001","targetPeakNits":2000,"transfer":"metal-edr-linear"}],"requestId":"hdr-review-2ee7116-ev3-background-20260906-02","reviewSessionId":"hdr-session-2ee7116-ev3-background-20260906-02","schema":"stoner.hdr-live-review-request","schemaVersion":1,"state":"ready-for-live-review","workloadRevision":"production-content-lantern-v3"}
